{
  "$schema": "./model.schema.json",
  "schemaVersion": "1.0.0",
  "meta": {
    "title": "受注・実績登録業務の As-is / To-be",
    "subtitle": "構造化受付・例外処理化・基幹連携による業務改善（サンプル）",
    "version": "0.1.0",
    "status": "draft",
    "language": "ja",
    "purpose": "現行の手作業・差戻し・二重入力を可視化し、To-beの変更方針と追加確認事項を合意する",
    "audience": ["業務責任者", "営業部門", "システム企画", "FDE / 開発チーム"],
    "owner": "業務改革プロジェクト",
    "approver": "未定",
    "scope": {
      "start": "顧客または営業担当から登録依頼を受け付ける",
      "end": "基幹システムへの登録結果を確認し、依頼者へ完了通知する",
      "inScope": ["依頼受付", "情報収集", "内容確認", "承認", "基幹登録", "完了確認"],
      "outOfScope": ["契約交渉", "請求・入金", "基幹システム自体の刷新"]
    },
    "sources": [
      {
        "id": "S-01",
        "label": "添付されたAs-is / To-be図イメージ",
        "kind": "image",
        "reference": "examples/source-reference.png",
        "date": "2026-07-29",
        "confidence": "medium",
        "note": "構成・表現の参考。細部の正確な転記ではなく、再設計サンプルとして利用"
      },
      {
        "id": "S-02",
        "label": "デモ用の仮説ヒアリング結果",
        "kind": "assumption",
        "confidence": "low",
        "note": "サンプルを成立させるための仮定。実案件では担当者確認が必要"
      }
    ],
    "assumptions": [
      {
        "id": "AS-01",
        "text": "受付情報はメール・添付ファイル・既存台帳に分散している",
        "status": "unverified",
        "sourceIds": ["S-01", "S-02"],
        "owner": "業務責任者"
      },
      {
        "id": "AS-02",
        "text": "To-beでは通常案件を自動処理し、例外だけを人が確認する方針である",
        "status": "unverified",
        "sourceIds": ["S-02"],
        "owner": "プロジェクト責任者"
      }
    ],
    "conflicts": [],
    "confidentiality": "internal",
    "createdAt": "2026-07-29",
    "updatedAt": "2026-07-29",
    "generatedBy": "fde-asis-tobe skill sample",
    "changeLog": [
      {
        "version": "0.1.0",
        "date": "2026-07-29",
        "summary": "添付イメージを参考に、再利用可能なサンプルモデルを新規作成",
        "author": "AI-generated sample"
      }
    ]
  },
  "objectives": [
    {
      "id": "O-01",
      "title": "受付情報を標準化する",
      "description": "入力項目と必須条件を前工程で揃える",
      "priority": "must",
      "sourceIds": ["S-02"]
    },
    {
      "id": "O-02",
      "title": "人は例外判断に集中する",
      "description": "定型照合・転記を自動化し、人による確認を例外に限定する",
      "priority": "must",
      "sourceIds": ["S-02"]
    },
    {
      "id": "O-03",
      "title": "登録結果を追跡可能にする",
      "description": "受付から基幹登録・通知まで同一IDで監査可能にする",
      "priority": "should",
      "sourceIds": ["S-02"]
    }
  ],
  "states": [
    {
      "id": "asis",
      "label": "As-is",
      "summary": "複数資料を人が収集・照合し、差戻し後に基幹システムへ再入力する",
      "theme": "asis",
      "lanes": [
        { "id": "customer", "label": "依頼者 / 顧客", "group": "社外・依頼元", "kind": "external" },
        { "id": "assistant", "label": "営業アシスタント", "group": "営業部門", "kind": "role" },
        { "id": "sales", "label": "営業担当", "group": "営業部門", "kind": "role" },
        { "id": "manager", "label": "管理者", "group": "管理・統制", "kind": "role" },
        { "id": "automation", "label": "自動化 / 連携基盤", "group": "システム", "kind": "automation" },
        { "id": "core", "label": "基幹システム", "group": "システム", "kind": "system" }
      ],
      "stages": [
        { "id": "request", "label": "依頼" },
        { "id": "collect", "label": "情報収集" },
        { "id": "check", "label": "内容確認" },
        { "id": "approve", "label": "承認" },
        { "id": "register", "label": "登録" },
        { "id": "complete", "label": "完了" }
      ],
      "groups": [
        {
          "id": "AG-01",
          "label": "手作業による収集・照合・差戻し",
          "laneIds": ["assistant", "sales"],
          "stageIds": ["collect", "check"],
          "kind": "subprocess",
          "description": "メール、添付ファイル、台帳を横断して確認する",
          "style": "dashed"
        }
      ],
      "nodes": [
        {
          "id": "A-START",
          "label": "登録依頼が発生",
          "type": "start",
          "lane": "customer",
          "stage": "request",
          "order": 1,
          "mode": "manual",
          "status": "confirmed",
          "sourceIds": ["S-01"]
        },
        {
          "id": "A-01",
          "label": "メールと添付資料を送付する",
          "type": "document",
          "lane": "customer",
          "stage": "request",
          "order": 2,
          "detail": "自由記述メール、Excel、PDF等を想定",
          "mode": "manual",
          "data": ["依頼内容", "添付資料"],
          "painPointIds": ["P-01"],
          "sourceIds": ["S-01", "S-02"]
        },
        {
          "id": "A-02",
          "label": "複数資料から情報を集める",
          "type": "activity",
          "lane": "assistant",
          "stage": "collect",
          "order": 1,
          "detail": "メール、添付ファイル、既存台帳から必要項目を抽出",
          "owner": "営業アシスタント",
          "mode": "manual",
          "painPointIds": ["P-01", "P-04"],
          "sourceIds": ["S-01", "S-02"]
        },
        {
          "id": "A-03",
          "label": "台帳へ転記し形式を整える",
          "type": "document",
          "lane": "assistant",
          "stage": "collect",
          "order": 2,
          "detail": "後続確認のために項目名・形式を手作業で揃える",
          "owner": "営業アシスタント",
          "mode": "manual",
          "painPointIds": ["P-02", "P-04"],
          "sourceIds": ["S-02"]
        },
        {
          "id": "A-04",
          "label": "必要項目は揃っているか",
          "type": "decision",
          "lane": "assistant",
          "stage": "check",
          "order": 1,
          "detail": "必須項目・マスタ整合・重複を目視確認",
          "owner": "営業アシスタント",
          "mode": "manual",
          "painPointIds": ["P-03", "P-04"],
          "sourceIds": ["S-01", "S-02"]
        },
        {
          "id": "A-05",
          "label": "不足情報を確認する",
          "type": "activity",
          "lane": "sales",
          "stage": "check",
          "order": 1,
          "detail": "依頼者へ再確認し、回答をアシスタントへ返す",
          "owner": "営業担当",
          "mode": "manual",
          "painPointIds": ["P-03"],
          "sourceIds": ["S-01", "S-02"]
        },
        {
          "id": "A-06",
          "label": "回答を反映し再確認する",
          "type": "activity",
          "lane": "assistant",
          "stage": "check",
          "order": 2,
          "owner": "営業アシスタント",
          "mode": "manual",
          "painPointIds": ["P-03", "P-04"],
          "sourceIds": ["S-02"]
        },
        {
          "id": "A-07",
          "label": "登録内容を承認する",
          "type": "control",
          "lane": "manager",
          "stage": "approve",
          "order": 1,
          "detail": "承認条件は未確認",
          "owner": "管理者",
          "mode": "manual",
          "status": "unconfirmed",
          "sourceIds": ["S-01", "S-02"]
        },
        {
          "id": "A-08",
          "label": "基幹システムへ手入力する",
          "type": "activity",
          "lane": "assistant",
          "stage": "register",
          "order": 1,
          "detail": "台帳の内容を画面へ再入力する",
          "owner": "営業アシスタント",
          "mode": "manual",
          "system": "基幹システム",
          "painPointIds": ["P-02", "P-04"],
          "sourceIds": ["S-01", "S-02"]
        },
        {
          "id": "A-09",
          "label": "登録データを保存する",
          "type": "system",
          "lane": "core",
          "stage": "register",
          "order": 1,
          "mode": "automated",
          "system": "基幹システム",
          "sourceIds": ["S-01"]
        },
        {
          "id": "A-10",
          "label": "登録結果を目視で照合する",
          "type": "activity",
          "lane": "assistant",
          "stage": "complete",
          "order": 1,
          "owner": "営業アシスタント",
          "mode": "manual",
          "painPointIds": ["P-02", "P-04"],
          "sourceIds": ["S-02"]
        },
        {
          "id": "A-END",
          "label": "完了を連絡する",
          "type": "end",
          "lane": "customer",
          "stage": "complete",
          "order": 1,
          "mode": "manual",
          "sourceIds": ["S-01"]
        }
      ],
      "edges": [
        { "id": "AE-01", "from": "A-START", "to": "A-01", "type": "sequence" },
        { "id": "AE-02", "from": "A-01", "to": "A-02", "type": "manual-handoff", "label": "メール / 添付" },
        { "id": "AE-03", "from": "A-02", "to": "A-03", "type": "sequence" },
        { "id": "AE-04", "from": "A-03", "to": "A-04", "type": "sequence" },
        { "id": "AE-05", "from": "A-04", "to": "A-05", "type": "exception", "label": "不備・不明あり", "painPointIds": ["P-03"] },
        { "id": "AE-06", "from": "A-05", "to": "A-06", "type": "manual-handoff", "label": "回答" },
        { "id": "AE-07", "from": "A-06", "to": "A-04", "type": "exception", "label": "再確認", "route": "bottom", "painPointIds": ["P-03"] },
        { "id": "AE-08", "from": "A-04", "to": "A-07", "type": "control", "label": "確認済み" },
        { "id": "AE-09", "from": "A-07", "to": "A-08", "type": "sequence", "label": "承認" },
        { "id": "AE-10", "from": "A-08", "to": "A-09", "type": "manual-handoff", "label": "画面入力" },
        { "id": "AE-11", "from": "A-09", "to": "A-10", "type": "data", "label": "登録結果" },
        { "id": "AE-12", "from": "A-10", "to": "A-END", "type": "manual-handoff", "label": "完了連絡" }
      ]
    },
    {
      "id": "tobe",
      "label": "To-be",
      "summary": "入力を構造化し、マスタ照会・検証・登録・照合を自動化して例外だけを人が処理する",
      "theme": "tobe",
      "lanes": [
        { "id": "customer", "label": "依頼者 / 顧客", "group": "社外・依頼元", "kind": "external" },
        { "id": "assistant", "label": "営業アシスタント", "group": "営業部門", "kind": "role" },
        { "id": "sales", "label": "営業担当", "group": "営業部門", "kind": "role" },
        { "id": "manager", "label": "管理者", "group": "管理・統制", "kind": "role" },
        { "id": "automation", "label": "自動化 / 連携基盤", "group": "システム", "kind": "automation" },
        { "id": "core", "label": "基幹システム", "group": "システム", "kind": "system" }
      ],
      "stages": [
        { "id": "request", "label": "依頼" },
        { "id": "collect", "label": "情報収集" },
        { "id": "check", "label": "内容確認" },
        { "id": "approve", "label": "承認" },
        { "id": "register", "label": "登録" },
        { "id": "complete", "label": "完了" }
      ],
      "groups": [
        {
          "id": "TG-01",